,seq,name,name2,content,isconfirmed,class
1850,1850,عبدالمجيد الخطيب ,سعيد الرمضاني,الحاج ابراهيم  و كان عبدالمجيد انذاك طالبا يواصل تحصيل ه العلمي على عده شيوخ من هم الشيخ احمد و الشيخ قاسم جلبي و الشيخ احمد القليجي و الشيخ ,False,STUDY
1851,1851,عبدالمجيد الخطيب ,احمد الجراح,كان عبدالمجيد انذاك طالبا يواصل تحصيل ه العلمي على عده شيوخ من هم الشيخ احمد و الشيخ قاسم جلبي و الشيخ احمد القليجي و الشيخ سعيد الرمضاني و الشيخ ,False,STUDY
1852,1852,عبدالمجيد الخطيب ,عبدالغفور الحبار,يواصل تحصيل ه العلمي على عده شيوخ من هم الشيخ احمد و الشيخ قاسم جلبي و الشيخ احمد القليجي و الشيخ سعيد الرمضاني و الشيخ احمد الجراح و الشيخ ,False,STUDY
1853,1853,عبدالمجيد الخطيب ,صالح الجهادي,على عده شيوخ من هم الشيخ احمد و الشيخ قاسم جلبي و الشيخ احمد القليجي و الشيخ سعيد الرمضاني و الشيخ احمد الجراح و الشيخ عبدالغفور الحبار و الشيخ ,False,STUDY
1854,1854,عبدالمجيد الخطيب ,ابراهيم القصاب,هم الشيخ احمد و الشيخ قاسم جلبي و الشيخ احمد القليجي و الشيخ سعيد الرمضاني و الشيخ احمد الجراح و الشيخ عبدالغفور الحبار و الشيخ صالح الجهادي و الشيخ ,False,STUDY
1855,1855,عبدالمجيد الخطيب ,عبدالله النعمه,الشيخ قاسم جلبي و الشيخ احمد القليجي و الشيخ سعيد الرمضاني و الشيخ احمد الجراح و الشيخ عبدالغفور الحبار و الشيخ صالح الجهادي و الشيخ ابراهيم القصاب و الشيخ ,False,STUDY
1856,1856,عبدالمجيد الخطيب ,مصطفى الدباغ,الشيخ احمد القليجي و الشيخ سعيد الرمضاني و الشيخ احمد الجراح و الشيخ عبدالغفور الحبار و الشيخ صالح الجهادي و الشيخ ابراهيم القصاب و الشيخ عبدالله النعمه و الشيخ ,False,STUDY
1857,1857,عبدالمجيد الخطيب ,بشير الصقال,الشيخ سعيد الرمضاني و الشيخ احمد الجراح و الشيخ عبدالغفور الحبار و الشيخ صالح الجهادي و الشيخ ابراهيم القصاب و الشيخ عبدالله النعمه و الشيخ مصطفى الدباغ و الشيخ ,False,STUDY
1858,1858,عبدالمجيد الخطيب ,محمد رؤوف الغلامي,و الشيخ احمد الجراح و الشيخ عبدالغفور الحبار و الشيخ صالح الجهادي و الشيخ ابراهيم القصاب و الشيخ عبدالله النعمه و الشيخ مصطفى الدباغ و الشيخ بشير الصقال و ,False,STUDY
1859,1859,عبدالمجيد الخطيب ,محمد الرضواني,الشيخ عبدالله النعمه و الشيخ مصطفى الدباغ و الشيخ بشير الصقال و محمد رؤوف الغلامي  و كان يحضر انذاك صباحا مع السيد توفيق درسا من دروسالدين ل لشخ ,False,STUDY
1860,1860,عبدالمجيد الخطيب ,عبدالرحمن صالح,و كان يحضر انذاك صباحا مع السيد توفيق درسا من دروسالدين ل لشخ محمد الرضواني  و اجاز ه في قراءه الصلوات عام 1930 م و درس التاريخ على ,False,STUDY
1861,1861,عبدالمجيد الخطيب ,محمد صالح الجوادي,مع السيد توفيق درسا من دروسالدين ل لشخ محمد الرضواني  و اجاز ه في قراءه الصلوات عام 1930 م و درس التاريخ على عبدالرحمن صالح و التجويد على ,False,STUDY
1862,1862,عبدالمجيد الخطيب ,احمد الجوادي,لشخ محمد الرضواني  و اجاز ه في قراءه الصلوات عام 1930 م و درس التاريخ على عبدالرحمن صالح و التجويد على محمد صالح الجوادي و القراءات على الشيخ ,False,STUDY
1863,1863,عبدالمجيد الخطيب ,حسن باشا,و كانت تجري كل سنه امتحانات ل لطلاب الاول في نصف السنه السنه و نهايت ها من قبل لجنه من العلماء من مدرسه ,False,MENTION
1864,1864,عبدالمجيد الخطيب ,عبدالمجيد الخطيب,و كانت تجري كل سنه امتحانات ل لطلاب الاول في نصف السنه السنه و نهايت ها من قبل لجنه من العلماء من مدرسه حسن باشا  و اجتاز ,True,SAME PERSON
1865,1865,عبدالمجيد الخطيب ,حسن باشا,مدرسه حسن باشا  و اجتاز عبدالمجيد الخطيب امتحانا ل لخطابه عام 1935 و امتحانا اخر لوعظ جامع النبي شيت ف وفق في ه ثم عين محافظا ل مكتبه ,False,MISC
1866,1866,عبدالمجيد الخطيب ,احمد الجوادي,و درس الخطيب بين عامي 1354-1358 ه القراءات على الشيخ ,False,STUDY
1867,1867,عبدالمجيد الخطيب ,محمد نجيب الجادر,و عين الخطيب عام 1954 مدرسا في مدرسه ,False,WORK
1868,1868,عبدالمجيد الخطيب ,محمد رؤوف الغلامي,و عين الخطيب عام 1954 مدرسا في مدرسه محمد نجيب الجادر و اسندت الي ه المكتبه الملحقه ب ها  و سافر الى بغداد ل لدراسه على ,False,WORK
1869,1869,عبدالمجيد الخطيب ,محمد البقري,3- متن البقريه ل لشيخ ,False,MISC
1870,1870,عبدالمجيد الخطيب ,محمد البقري,4- غنيه الطالبين و منيه الراغبين في التجويد ل لشيخ ,False,MISC
1871,1871,عبدالمجيد الخطيب ,عبدالمجيد الخطيب,nan,True,SAME PERSON
1872,1872,عبدالمجيد الخطيب ,ال الخطيب,عبدالمجيد الخطيب و القراءات :- يبدا الخطيب كتاب ه الاول توضيح اصول قواعد الشفع في نشرعلم القراءات السبع ب ذكر نسب ,False,SAME PERSON
1873,1873,عبدالمجيد الخطيب ,عبدالمجيد الخطيب,على شيخ ه من كتب العلم قراءه درس و فهم لقن من شيخ ه مسائل شتى اذا كان شيخ ه من حفاظ عصر ه ص13 - 14 ثم اورد ,True,SAME PERSON
1874,1874,عبدالمجيد الخطيب ,عبدالله الفيضي,القراء و ضروع هم و اجازات هم و عمن اخذوا من العلم من سنه 1000-1392 هوذكر من الاسماء التي دخلت في القرن العشرين و عرفت على نطاق الموصل : ,False,STUDY
1875,1875,عبدالمجيد الخطيب ,محمد جرجيس النوري,هم و اجازات هم و عمن اخذوا من العلم من سنه 1000-1392 هوذكر من الاسماء التي دخلت في القرن العشرين و عرفت على نطاق الموصل : عبدالله الفيضي و ,False,STUDY
1876,1876,عبدالمجيد الخطيب ,محمد شيت الجومرد,عمن اخذوا من العلم من سنه 1000-1392 هوذكر من الاسماء التي دخلت في القرن العشرين و عرفت على نطاق الموصل : عبدالله الفيضي و محمد جرجيس النوري  و ,False,STUDY
1877,1877,عبدالمجيد الخطيب ,محمد خضر الحبار,من سنه 1000-1392 هوذكر من الاسماء التي دخلت في القرن العشرين و عرفت على نطاق الموصل : عبدالله الفيضي و محمد جرجيس النوري  و محمد شيت الجومرد و ,False,STUDY
1878,1878,عبدالمجيد الخطيب ,ملا حسن,من الاسماء التي دخلت في القرن العشرين و عرفت على نطاق الموصل : عبدالله الفيضي و محمد جرجيس النوري  و محمد شيت الجومرد و محمد خضر الحبار و ,False,MISC
1879,1879,عبدالمجيد الخطيب ,ملا عثمان الموصلي,القرن العشرين و عرفت على نطاق الموصل : عبدالله الفيضي و محمد جرجيس النوري  و محمد شيت الجومرد و محمد خضر الحبار و ملا حسن شويش  و ,False,MISC
1880,1880,عبدالمجيد الخطيب ,اسماعيل الخطيب,على نطاق الموصل : عبدالله الفيضي و محمد جرجيس النوري  و محمد شيت الجومرد و محمد خضر الحبار و ملا حسن شويش  و ملا عثمان الموصلي و ,False,MISC
1881,1881,عبدالمجيد الخطيب ,احمد الجوادي,عبدالله الفيضي و محمد جرجيس النوري  و محمد شيت الجومرد و محمد خضر الحبار و ملا حسن شويش  و ملا عثمان الموصلي و اسماعيل الخطيب  و ,False,MISC
1882,1882,عبدالمجيد الخطيب ,محمد صالح الجوادي,محمد جرجيس النوري  و محمد شيت الجومرد و محمد خضر الحبار و ملا حسن شويش  و ملا عثمان الموصلي و اسماعيل الخطيب  و احمد الجوادي و ,False,COMPANIONSHIP
1883,1883,عبدالمجيد الخطيب ,عبدالوهاب الفخري,و محمد خضر الحبار و ملا حسن شويش  و ملا عثمان الموصلي و اسماعيل الخطيب  و احمد الجوادي و محمد صالح الجوادي و عبد المجديد الخطيب و ,False,STUDY
1884,1884,عبدالمجيد الخطيب ,عبدالفتاح الجومرد,الحبار و ملا حسن شويش  و ملا عثمان الموصلي و اسماعيل الخطيب  و احمد الجوادي و محمد صالح الجوادي و عبد المجديد الخطيب و عبدالوهاب الفخري و ,False,STUDY
1885,1885,عبدالمجيد الخطيب ,محمد فائق الدبوني,حسن شويش  و ملا عثمان الموصلي و اسماعيل الخطيب  و احمد الجوادي و محمد صالح الجوادي و عبد المجديد الخطيب و عبدالوهاب الفخري و عبدالفتاح الجومرد و ,False,STUDY
1886,1886,عبدالمجيد الخطيب ,نعمهالله النعمه,ملا عثمان الموصلي و اسماعيل الخطيب  و احمد الجوادي و محمد صالح الجوادي و عبد المجديد الخطيب و عبدالوهاب الفخري و عبدالفتاح الجومرد و محمد فائق الدبوني و ,False,STUDY
1887,1887,عبدالمجيد الخطيب ,سالم عبدالرزاق,و اسماعيل الخطيب  و احمد الجوادي و محمد صالح الجوادي و عبد المجديد الخطيب و عبدالوهاب الفخري و عبدالفتاح الجومرد و محمد فائق الدبوني و نعمهالله النعمه و ,False,STUDY
1888,1888,عبدالمجيد الخطيب ,محمد امين الرمضاني,و احمد الجوادي و محمد صالح الجوادي و عبد المجديد الخطيب و عبدالوهاب الفخري و عبدالفتاح الجومرد و محمد فائق الدبوني و نعمهالله النعمه و سالم عبدالرزاق  و ,False,STUDY
1889,1889,عبدالمجيد الخطيب ,توفيق زين العابدين,عبد المجديد الخطيب و عبدالوهاب الفخري و عبدالفتاح الجومرد و محمد فائق الدبوني و نعمهالله النعمه و سالم عبدالرزاق  و محمد امين الرمضاني و عبد الجواد الجوادي و ,False,STUDY
1890,1890,عبدالمجيد الخطيب ,صالح حسين,عبدالوهاب الفخري و عبدالفتاح الجومرد و محمد فائق الدبوني و نعمهالله النعمه و سالم عبدالرزاق  و محمد امين الرمضاني و عبد الجواد الجوادي و توفيق زين العابدين و ,False,STUDY
1891,1891,عبدالمجيد الخطيب ,محمد الدبوني,عبدالفتاح الجومرد و محمد فائق الدبوني و نعمهالله النعمه و سالم عبدالرزاق  و محمد امين الرمضاني و عبد الجواد الجوادي و توفيق زين العابدين و صالح حسين و ,False,STUDY
1892,1892,عبدالمجيد الخطيب ,محمد امين محمد سعيد ملا يوسف,محمد فائق الدبوني و نعمهالله النعمه و سالم عبدالرزاق  و محمد امين الرمضاني و عبد الجواد الجوادي و توفيق زين العابدين و صالح حسين و محمد الدبوني و ,False,STUDY
1893,1893,عبدالمجيد الخطيب ,محمد صالح الحبار,سالم عبدالرزاق  و محمد امين الرمضاني و عبد الجواد الجوادي و توفيق زين العابدين و صالح حسين و محمد الدبوني و محمد امين محمد سعيد ملا يوسف و ,False,STUDY
1894,1894,عبدالمجيد الخطيب ,مصطفى محمد طاهر,و ذكر من شيوخ قراء العشره : ,False,STUDY
1895,1895,عبدالمجيد الخطيب ,ملا عثمان الموصلي,و ذكر من شيوخ قراء العشره : مصطفى محمد طاهر و يوسف عجور المصري  و ,False,STUDY
1896,1896,عبدالمجيد الخطيب ,محمد صالح الجوادي,و ذكر من شيوخ قراء العشره : مصطفى محمد طاهر و يوسف عجور المصري  و ملا عثمان الموصلي و ,False,STUDY
1897,1897,عبدالمجيد الخطيب ,محمد البقري,و فصل في القراءات و اللهجه و اللغه و اصحاب القراءات المستعمله الى هذا اليوم و ترجم ه ل لعلامه ابوالاكرام ,False,MISC
1898,1898,عبدالمجيد الخطيب ,سلطان ناصر احمد الجبوري,و اللغه و اصحاب القراءات المستعمله الى هذا اليوم و ترجم ه ل لعلامه ابوالاكرام محمد البقري و اتصال ه الى شيوخ ه في القراءات  و ترجمه الشيخ ,False,STUDY
1899,1899,عبدالمجيد الخطيب ,عبدالمجيد الخطيب,ثم انتقل ,True,SAME PERSON
1900,1900,عبدالمجيد الخطيب ,سلطان الجبوري,ثم انتقل عبدالمجيد الخطيب الى الرموز الحرفيه و ما يدل علي ه كل حرف من القراء و حقق مخطوطه ,False,STUDY
1901,1901,عبدالمجيد الخطيب ,محمد قاسم البقري,يدل علي ه كل حرف من القراء و حقق مخطوطه سلطان الجبوري الموسومه العقود المجوهره و اللاليء المبتكره في شرح متن البقريه ). و نشر متن البقريه ل لشيخ ,False,MISC
1902,1902,عبدالمجيد الخطيب ,سلطان ناصر الجبوري,فضلا عن نشر ه رساله القول المبين في تكبير سنه المكبين ل ,False,MENTION
1903,1903,عبدالمجيد الخطيب ,عبدالمجيد الخطيب,و عقد ,True,SAME PERSON
1904,1904,عبدالمجيد الخطيب ,سلطان الجبوري,و عقد عبدالمجيد الخطيب مبحثا اخيرا في كتاب ه عن اجازات الشيوخ القراء بين سنتي 1000-1392 ه و تواريخ شروح البقريه ل لشيخ ,False,MISC
1905,1905,عبدالمجيد الخطيب ,احمد عبدالوهاب الجوادي,فضلا عن ترجمه ل بعض القراء مثل ,False,MENTION
1906,1906,عبدالمجيد الخطيب ,عبدالله محمد النعمه,فضلا عن ترجمه ل بعض القراء مثل احمد عبدالوهاب الجوادي و ,False,MENTION
1907,1907,عبدالمجيد الخطيب ,محمد رؤوف الغلامي,فضلا عن ترجمه ل بعض القراء مثل احمد عبدالوهاب الجوادي و عبدالله محمد النعمه و ,False,COMPANIONSHIP
1908,1908,عبدالمجيد الخطيب ,محمد صالح الجوادي,فضلا عن ترجمه ل بعض القراء مثل احمد عبدالوهاب الجوادي و عبدالله محمد النعمه و محمد رؤوف الغلامي و ,False,COMPANIONSHIP
1909,1909,عبدالمجيد الخطيب ,سالم عبدالرزاق,فضلا عن ترجمه ل بعض القراء مثل احمد عبدالوهاب الجوادي و عبدالله محمد النعمه و محمد رؤوف الغلامي و محمد صالح الجوادي و ,False,STUDY
1910,1910,عبدالمجيد شوقي البكري ,عبدالمجيد شوقي البكري ,nan,True,SAME PERSON
1911,1911,عبدالمجيد شوقي البكري ,علي الجميل,في العهد العثماني  و تخرج من المدرسه الاعداديه عام 1914 و سافر الى اسطنبول ل اكمال دراست ه ف اتخذ المنتدى الادبي منزلا ل ه بدلاله صديق ه ,False,MISC
1912,1912,عبدالمجيد شوقي البكري ,عبدالله النعمه,و شارك البكري في تاسيس جمعيه البر الاسلاميه و جمعيه الشبان المسلمين و درس علومالدين على ,False,MISC
1913,1913,عبدالمجيد شوقي البكري ,ال داود,جمع الاسرائيليات من كتب التفاسير ورد على اليهود ف الف كتبا عده : كتاب البشريه و ابوالبشر  قصه الطوفان عروببيه ابراهيم  بين مدين و الاردن  مملكه ,False,MISC
1914,1914,عبدالمجيد شوقي البكري ,عبدالمجيد شوقي,القرنين التبعي  ام اللغات و علم الاشتقاق و المقابلات القوميه العربيه  المعركه الحاسمه مع اليهود متى تكون  الوحي و التنزيل 17 و توفي عام 1968 اشتغل ,False,SAME PERSON
1915,1915,عبدالمجيد شوقي البكري ,رؤوف الغلامي,ام اللغات و علم الاشتقاق و المقابلات القوميه العربيه  المعركه الحاسمه مع اليهود متى تكون  الوحي و التنزيل 17 و توفي عام 1968 اشتغل عبدالمجيد شوقي مع ,False,WORK
1916,1916,عبدالمجيد شوقي البكري ,رؤوف الغلامي,مقهى الحمراء الذي اصبح ب صفه رسميه النهل السائغ ل رواد الادب و ماوى ل لوطنين و معهدا عاما ل سائر افراد الامه في مختلف الطبقات  و وسع ,False,MISC
1917,1917,عبدالمجيد شوقي البكري ,ثابت عبدالنور,رؤوف الغلامي هذا النادي ب تاسيس ناد اخر سما ه نادي الانتباه العربي و تاسس ناد اخر في بغداد يحقق نفس الهدف ب اسم المعهد العلمي الذي اسس ه ,False,WORK
1918,1918,عبدالمجيد شوقي البكري ,محمد رؤوف الغلامي,في نفوس الشبان و تطلع هم على سير اجداد هم الماضين و تشكلت لجنه اداريه ل لتمثيل عام 1921 قوام ها خمسه اشخاص من اعضاء نادي الانتباه العربي هم ,False,STUDY
1919,1919,عبدالمجيد شوقي البكري ,حسيب السعدي,هم على سير اجداد هم الماضين و تشكلت لجنه اداريه ل لتمثيل عام 1921 قوام ها خمسه اشخاص من اعضاء نادي الانتباه العربي هم محمد رؤوف الغلامي  و ,False,WORK
1920,1920,عبدالمجيد شوقي البكري ,فاضل الصيدلي,هم الماضين و تشكلت لجنه اداريه ل لتمثيل عام 1921 قوام ها خمسه اشخاص من اعضاء نادي الانتباه العربي هم محمد رؤوف الغلامي  و حسيب السعدي  و ,False,WORK
1921,1921,عبدالمجيد شوقي البكري ,اسماعيل فرج,لجنه اداريه ل لتمثيل عام 1921 قوام ها خمسه اشخاص من اعضاء نادي الانتباه العربي هم محمد رؤوف الغلامي  و حسيب السعدي  و فاضل الصيدلي  و ,False,WORK
1922,1922,عبدالمجيد شوقي البكري ,عبدالمجيد شوقي البكري,لتمثيل عام 1921 قوام ها خمسه اشخاص من اعضاء نادي الانتباه العربي هم محمد رؤوف الغلامي  و حسيب السعدي  و فاضل الصيدلي  و اسماعيل فرج  ,True,SAME PERSON
1923,1923,عبدالمجيد شوقي البكري ,عبدالمجيد شوقي,و حسيب السعدي  و فاضل الصيدلي  و اسماعيل فرج  عبدالمجيد شوقي البكري و قررت لجنه اداره التمثيل  تمثيل مسرحيه فتح عموريه اولا و عهدت الى ,False,SAME PERSON
1924,1924,عبدالمجيد شوقي البكري ,فاضل الصيدلي, و اسماعيل فرج  عبدالمجيد شوقي البكري و قررت لجنه اداره التمثيل  تمثيل مسرحيه فتح عموريه اولا و عهدت الى عبدالمجيد شوقي وضع هذه المسرحيه و الى ,False,WORK
1925,1925,عبدالمجيد شوقي البكري ,فاضل الصيدلي,و مثلت عام 1922 ك ما مثل اعضاء نادي الانتباه مسرحيتي فتح الاندلس  و شهداء الوطنيه الهولنديين بعد تغيير طابع ها الى طابع عربي  و عهد الى ,False,WORK
1926,1926,عبدالمجيد شوقي البكري ,عبدالمجيد شوقي,الف ما في القصص الشعبي من مغامرات و ما لاسلوب هما من الوان موسيقيه ك الاناشيد و المقطوعات الشعريه التي يوضع ل ها الحوار  و قال ل ي ,False,SAME PERSON
1927,1927,عبدالمجيد شوقي البكري ,ابراهيم الخليل,3- عروبيه ,False,MISC
1928,1928,عبدالمجيد شوقي البكري ,ال داود,7- مملكه ,False,MISC
1929,1929,عبدالمحسن عقراوي ,عبدالمحسن عقراوي ,nan,True,SAME PERSON
1930,1930,عبدالمحسن عقراوي ,حسن العمري,عام 1976. 2- سبع اغنيات ل تموز مجموعه مشتركه عام 1978 3- هشيم الغربه عام 1981. 4- لن تتعب البنادق مجموعه مشتركه عام 1984 5- كلكامش عام 1985 ترجمه ,False,WORK
1931,1931,عبدالمحسن عقراوي ,ذنون الشهاب,و الذي دفع ه ل قول الشعر اُستاذ ه ,False,MISC
1932,1932,عبدالمحسن عقراوي ,اسماعيل حقي فرج,زهير و من الامويين بني عذره و جرير و من العباسيين : العباس الاحنف و ابا تمام و المتنبي و من شعراء الموصل الذين عايش هم ب عجب ه ,False,MISC
1933,1933,عبدالمحسن عقراوي ,عدنان الراوي,بني عذره و جرير و من العباسيين : العباس الاحنف و ابا تمام و المتنبي و من شعراء الموصل الذين عايش هم ب عجب ه اسماعيل حقي فرج و ,False,MISC
1934,1934,عبدالمحسن عقراوي ,سالم الخباز,جرير و من العباسيين : العباس الاحنف و ابا تمام و المتنبي و من شعراء الموصل الذين عايش هم ب عجب ه اسماعيل حقي فرج و عدنان الراوي و ,False,MISC
1935,1935,عبدالمحسن عقراوي ,كامل النعيمي,العباسيين : العباس الاحنف و ابا تمام و المتنبي و من شعراء الموصل الذين عايش هم ب عجب ه اسماعيل حقي فرج و عدنان الراوي و سالم الخباز و ,False,MISC
1936,1936,عبدالمحسن عقراوي ,ذنون الاطرقجي,الاحنف و ابا تمام و المتنبي و من شعراء الموصل الذين عايش هم ب عجب ه اسماعيل حقي فرج و عدنان الراوي و سالم الخباز و كامل النعيمي و ,False,MISC
1937,1937,عبدالمحسن عقراوي ,معد الجبوي,تمام و المتنبي و من شعراء الموصل الذين عايش هم ب عجب ه اسماعيل حقي فرج و عدنان الراوي و سالم الخباز و كامل النعيمي و ذنون الاطرقجي و ,False,COMPANIONSHIP
1938,1938,عبدالمحسن عقراوي ,عبدالمحسن عقراوي,و نشر اولى قصائد ه عام 1956 في جريده فتى العراق ب عنوان بين شاعر و شاعره ). يعد ,True,SAME PERSON
1939,1939,عبدالمطلب سيد محمد سيد علي الاعرجي ,محمد عبدالمطلب سيد,براءه الاختراع : 1- ,False,SAME PERSON
1940,1940,عبدالمطلب سيد محمد سيد علي الاعرجي ,هناء سعيد,براءه الاختراع : 1- محمد عبدالمطلب سيد و ,False,MISC
