,seq,name,name2,content,isconfirmed,class
897,897,جواد سليم ,جواد سليم ,الادبي / 9 ف ان مشكله جواد ان يكشف منزله الانسان من الوجود المحيطي و هنا يبدو ل سطوه الاشياء في محيط ه اثر ها في فن ه يقول ,True,SAME PERSON
898,898,حاتم حسامالدين ,سعيد الديوه جي,و عمل في جريده عراقيون و ل ه مقابلات و مقالات جيده في ها و لا سيما لقاء مع الاستاذ الدكتور ابي ,True,COMPANIONSHIP
899,899,حازم البكري ,حازم البكري ,nan,True,SAME PERSON
900,900,حازم البكري ,عبدالكريم قاسم,ساهم في الصراع السياسي الذي اعقب ثوره 14 تموز 1958 و كان المشاركون في اغتيال ,True,COMPETITION
901,901,حازم المفتي ,فؤاد محمد نجيب,ولد في الموصل من اسره من الساده ادخل ه والد ه ,True,FAMILY
902,902,حازم المفتي ,ياسين الهاشمي,اللواء عام 1954. و ساهم فضلا عن المحاماه و اعمال ه في الزراعه في الكتابه و نشر المقالات في عددا من الكتب صدر من ها العراق بين عهدين : ,True,MENTION
903,903,حازم المفتي ,بكر صدقي,و ساهم فضلا عن المحاماه و اعمال ه في الزراعه في الكتابه و نشر المقالات في عددا من الكتب صدر من ها العراق بين عهدين : ياسين الهاشمي و ,True,MENTION
904,904,حازم المفتي ,حازم المفتي ,في الحمدانيه و كيف عنيت الحكومه نواب ها 1953 و بقيت كتب ه الاخرى محفوظه القضاء في الاسلام  نقباء الموصل العلويين و ابناؤ هم مذكراتي ). و يظهر ,True,SAME PERSON
905,905,حازم المفتي ,حازم المفتي ,و عند ما ترك ,True,SAME PERSON
906,906,حازم باك ,حازم باك ,nan,True,SAME PERSON
907,907,حازم سعيد ,احمد الجوادي,يحتضر كان والد ه شديدا مع اولاد ه حازما في تربيت هم  عمل في الجيش و انتقل الى التعليم عام 1921 اصطحب ه مع ه الى مجلس الشيخ ,True,STUDY
908,908,حازم سعيد ,حازم سعيد ,شديدا مع اولاد ه حازما في تربيت هم  عمل في الجيش و انتقل الى التعليم عام 1921 اصطحب ه مع ه الى مجلس الشيخ احمد الجوادي  تلقى ,True,SAME PERSON
909,909,حازم سعيد ,بدر شاكر,2- قصيده جحيم الثوره طبعت في كراس اربعه شعراء و شاعره عام 1970. 3- قصائد هجاء ل لسياب طبعت في كتاب اضواء على شعر و حياه ,False,MISC
910,910,حازم سعيد ,حازم سعيد ,يتسم شعر ,True,SAME PERSON
911,911,حازم سعيد ,حازم سعيد ,الحادثات تناهى الشقاء ب ها و الضرر حملت ب ها مثخنات الجروح و طوفت في الارض نضو السهر طعين الجوانح لا استقر اسير الحياه صريح الفكر و قد خاض ,True,SAME PERSON
912,912,حازم عبدالله خضر ,حازم عبدالله,و بقي على المنوال نفس ه حتى مرض ب سرطان المخ و توفي ب السكته القلبيه بعد نجاح العمليه ب اسبوع و كان ,False,SAME PERSON
913,913,حامد عبدالمجيد الراوي ,حامد عبدالمجيد الراوي ,nan,True,SAME PERSON
914,914,حامد عبدالمجيد الراوي ,رجب الراوي,و ,False,MISC
915,915,حامد عبدالمجيد الراوي ,محمد الرضواني,المدائح النبويه و اقام حفلات المواليد و المناسبات و فتحت ل ه ابواب الرزق عاد الى الموصل عام 1927. ارتاد السيد حامد الدواوين و المجالس من ها مجلس الشيخ ,False,STUDY
916,916,حامد عبدالمجيد الراوي ,محمد طاهر الفخري,حفلات المواليد و المناسبات و فتحت ل ه ابواب الرزق عاد الى الموصل عام 1927. ارتاد السيد حامد الدواوين و المجالس من ها مجلس الشيخ محمد الرضواني و الشيخ ,False,STUDY
917,917,حامد عبدالمجيد الراوي ,محمد نوري الفخري,فتحت ل ه ابواب الرزق عاد الى الموصل عام 1927. ارتاد السيد حامد الدواوين و المجالس من ها مجلس الشيخ محمد الرضواني و الشيخ محمد طاهر الفخري و الشيخ ,False,STUDY
918,918,حامد عبدالمجيد الراوي ,عثمان الموصلي,الى الموصل عام 1927. ارتاد السيد حامد الدواوين و المجالس من ها مجلس الشيخ محمد الرضواني و الشيخ محمد طاهر الفخري و الشيخ محمد نوري الفخري و التقى الملا ,False,STUDY
919,919,حامد عبدالمجيد الراوي ,صالح افندي الجوادي,و تلقى علم التجويد على يد ,False,STUDY
920,920,حامد عبدالمجيد الراوي ,ابراهيم الراوي,و كان كثير التردد على بغداد يلتقي ب عم ه ,False,FAMILY
921,921,حامد عبدالمجيد الراوي ,حامد عبدالمجيد الراوي ,ه سرعه بديهيه و شاعريه حاضره ف عند ما زار الشيخ محمد البشير الابراهيمي الموصل في الخمسينات و هو من علماء الجزائر القى كلمه في علماء الموصل فاعقب ه ,True,SAME PERSON
922,922,حامد عبدالمجيد الراوي ,عبدالحليم اللاوند,علماء الجزائر القى كلمه في علماء الموصل فاعقب ه حامد الراوي ب قصيده مطلع ها : لا فضّ قول و لا صمت مسامعنا عن الخطاب الذي القيت ه فيناويؤكد ,False,WORK
923,923,حامد عبدالمجيد الراوي ,حامد عبدالمجيد الراوي ,ها : لا فضّ قول و لا صمت مسامعنا عن الخطاب الذي القيت ه فيناويؤكد عبدالحليم اللاوند في كتاب ه نظرات في الزحل و الادب الشعبي الموصلي اهميه مدائح ,True,SAME PERSON
924,924,حسبالله يحيى ,حسبالله يحيى ,nan,True,SAME PERSON
925,925,حسبالله يحيى ,حسبالله يحيى,و قد امتلك ,True,SAME PERSON
926,926,حسبالله يحيى ,حسبالله يحيى,"في الصحراء وحيده ، عاد الصقر من جديد يغرز منقار ه في عيون الرجل ، و في الليل كانت الوحوش الهائمه تلتهم ه بلذه "" ص13 ). و يمتلك ",True,SAME PERSON
927,927,حسبالله يحيى ,حسبالله يحيى,"عشت صمتا رهيبا "" ص23 يهتم ",True,SAME PERSON
928,928,حسن النجفي ,حسن النجفي ,nan,True,SAME PERSON
929,929,حسن النجفي ,خليل الشماع,1976 7- القواعد الدوليه ل تفسير المصطلحات في عقود التجاره الدوليه الانكويتوم 1972 و1976  8- القاموس الاقتصادي انكليزي / عربي 1977 9- اداره المصارف ب الاشتراك مع الدكتور ,False,WORK
930,930,حسن النجفي ,صبحي جرجيس ابراهيم,القديم 1981 ترجم الى الانكليزيه و الالمانيه و الفرنسيه 14- معجم المصطلحات و الاعلام في العراق القديم انكليزي / عربي 1982 15- القواعد الموحده ل لسفتجه ب الاشتراك مع ,False,WORK
931,931,حسن النجفي ,حسن النجفي ,اهتم ,True,SAME PERSON
932,932,حسن زكريا ,حسن زكريا ,nan,True,SAME PERSON
933,933,حسن زكريا ,حسن زكريا ,المشترك و وجدت ه يرافق امراه اجنبيه لور نا الاسكوتلنديه و سرعان ما ادركت ان ل تلك المراه من المزايا العلميه و الاخلاقيه مامكن ها من ثقه د . ,True,SAME PERSON
934,934,حسن سليمان حسين علي الجميلي ,عبدالقادر عمر البغدادي,في اللغه و النحو / الموصل كليه الاداب / 1986. و حصل على الدكتوراه في اللغه و النحو / الموصل كليه الاداب / 1996. عنوان الرساله في الماجستير : ,False,STUDY
935,935,حسن طه حسن السنجاري  ,حسن طه حسن السنجاري  ,nan,True,SAME PERSON
936,936,حسن علي الذنون ,طلب وزير,و ,False,MISC
937,937,حسن علي الذنون ,وديع فرج,مصر حصل على الدبلوم عام 1942 و الدبلوم الخاص عام 1943 و حصل على الدكتوراه عام 1946 على رسالت ه الموسومه النظريه العامه ل لفسخ تحت اشراف د . ,False,STUDY
938,938,حسن علي الذنون ,ارشد العمري,ه الموسومه النظريه العامه ل لفسخ تحت اشراف د . وديع فرج القانون و عبدالوهاب فدام الشريعه ). و عين تدريسيا و عميدا في كليه الحقوق حتى اختار ه ,False,STUDY
939,939,حسن علي الذنون ,حسن علي الذنون ,و بقي عقد ه حتى الاحتلال في 9/4/2003 و يعد ,True,SAME PERSON
940,940,حسن علي الذنون ,محمد سعيد الرحو,و التامين من ها 2006. 19- المبسوط في المسؤوليه المدنيه : مسؤوليه الانسان عن فعل الغير 2007. 20- الوجيز في شرح القانون المدني الاردني : المصادر 2002 مشترك مع ,False,WORK
941,941,حسن علي الذنون ,محمد سعيد الرحو,21- الوجيز في شرح القانون المدني الاردني : الاحكام 2004 مشترك مع ,False,WORK
942,942,حسن فاشل ,حسن فاشل ,nan,True,SAME PERSON
943,943,حسن فاشل ,حسن فاشل ,ولد حسن خليل يعقوب الملقب ,True,SAME PERSON
944,944,حسن فاشل ,بلاوي علاوي,ماتون ممثلا و مخرجا 1967 رشيد المصور 1967 ممثلا و مخرجا  اخر حبل و انقطع 1974 ممثلا و مخرجا  علوان و مشاكل النسوان1984 ممثلا و مخرجا  ,False,COMPANIONSHIP
945,945,حسن فاشل ,بلاوي علاوي,ها 1987 الفاكهه الطيبه 1988 محلت نا 1989 الما يعرف تدابير ه 1994 تجار هذا الزمان1995  البورصجيه 1994 الحلبجي 1995 الجنون فنون1998  الحر يعرف ك يالبن 1997 ,False,MISC
946,946,حسن مطلك ,حسن مطلك ,nan,True,SAME PERSON
947,947,حسين الشكرجي,حسن الشكرجي,ولد في ناحيه الحمدانيه عام 1961 و اسم ه الكامل حسين سيدو ,False,FAMILY
948,948,حسين الشكرجي,ناظم الغزالي,ولد في ناحيه الحمدانيه عام 1961 و اسم ه الكامل حسين سيدو حسن الشكرجي  احب الغناء في صغر ه و ردد اغاني ,False,STUDY
949,949,حسين الشكرجي,محمد القبانجي,ولد في ناحيه الحمدانيه عام 1961 و اسم ه الكامل حسين سيدو حسن الشكرجي  احب الغناء في صغر ه و ردد اغاني ناظم الغزالي و ,False,STUDY
950,950,حسين الشكرجي,خالد عبد فتحي,ه الكامل حسين سيدو حسن الشكرجي  احب الغناء في صغر ه و ردد اغاني ناظم الغزالي و محمد القبانجي و حضيري ابوعزيز  تعلم الغناء على يد الفنان ,False,STUDY
951,951,حسين عبدالله  ,زكيه جورج,الاذاعه العراقيه منذ تاسيس ها الى ان توفا هالله  و كان احد العازفين الخمسه في الخماسي الوتري و صاحب جميع المطربين و المطربات العراقيات مثل سليمه مراد و ,False,WORK
952,952,حسين عبدالله  ,محمد القبانجي,كان احد العازفين الخمسه في الخماسي الوتري و صاحب جميع المطربين و المطربات العراقيات مثل سليمه مراد و زكيه جورج و صديقه الملاي ه و منير ه الهوزوز و ,False,WORK
953,953,حسين عبدالله  ,يوسف عمر,الخمسه في الخماسي الوتري و صاحب جميع المطربين و المطربات العراقيات مثل سليمه مراد و زكيه جورج و صديقه الملاي ه و منير ه الهوزوز و محمد القبانجي و ,False,WORK
954,954,حسين عبدالله  ,ناظم الغزالي,الوتري و صاحب جميع المطربين و المطربات العراقيات مثل سليمه مراد و زكيه جورج و صديقه الملاي ه و منير ه الهوزوز و محمد القبانجي و يوسف عمر و ,False,WORK
955,955,حسين علي الصفو ,احمد زيدان,التقى ب المطرب البغدادي المشهور احمد زيدان  و ل ه اسطوانات توفي عام 1911. كان من اشهر قراء المقام سافر الى بغداد و التقى ب المطرب البغدادي المشهور ,False,MISC
956,956,حسين قاسم الفخري ,احمد الفخري,خير الانام اليك شعري ولد عام 1929 في اسره يغلب علي ها الاصول الدينيه حفظ في المدرسه الابتدائيه محفوظات الشعر المقرره في الكتب و كان يتحدث مع اخي ه ,False,FAMILY
957,957,حسين قاسم الفخري ,حسين قاسم الفخري ,لقدامى و المعاصرين و حفظ و هو طالب في كليه الشريعه ديوان مع الفجر ل سليمان العيسى و كان زميلا لاخي ه احمد في دار المعلمين العاليه و اولع ,True,SAME PERSON
958,958,حسين قاسم الفخري ,حسين قاسم الفخري ,و انتقل ل لتدريس في معهد المعلمين و الاعداديه المركزيه و بقي في التعليم خمسا و ثلاثين سنه و احيل على التقاعد ب طلب من ه عام 1989 كان ,True,SAME PERSON
959,959,حسين قاسم الفخري ,جورج حبش,حتى ترك ها عند ما تبين علمانيت ها و موقف ها السلبي منالدين فاعتزل العمل الحزبي بعد عودت ه من سوريا بعد ان عرف زعماء الحركه عن كتب مثل ,False,WORK
960,960,حسين قاسم الفخري ,هاني الهندي,عند ما تبين علمانيت ها و موقف ها السلبي منالدين فاعتزل العمل الحزبي بعد عودت ه من سوريا بعد ان عرف زعماء الحركه عن كتب مثل جورج حبش و ,False,WORK
961,961,حسين قاسم الفخري ,يوسف ذنون,عودت ه من سوريا بعد ان عرف زعماء الحركه عن كتب مثل جورج حبش و هاني الهندي و الحكم دروز ه و شارك ه في الاعتزال السياسي صديقا ه ,False,MENTION
962,962,حسين قاسم الفخري ,سالم الحمداني,د . ,False,MISC
963,963,حكمت ذنون الكلو ,عبدالاله حسن,عمل مقدما ل برنامج 1 × 3 التلفزيوني الذي قدم من تلفزيون نينوى اعداد ,False,WORK
964,964,حكمت صالح ,حكمت صالح ,nan,True,SAME PERSON
965,965,حكمت صالح ,حكمت صالح ,العمل احيانا في حقلي الصناعه و التجاره استجابه ل متطلبات الحياه الضروريه الى جانب الشعر و كتابه الدراسات الادبيه في اطار رؤيه اسلاميه تنازعت كل نتاجه الفكري  يقول ,True,SAME PERSON
966,966,حكمت صالح ,محمد علي الرباوي,"3- قراءه في ديوان "" الرمانه الحجريه "" ل لشاعر المغربي ",False,MISC
967,967,حمد صالح ,محمود جنداري,ان ترك الجيش انتسب الى الوظائف الحكوميه و يحقق في دوائر الزراعه في ارياف نينوى ثم استقر في الموصل و اتجه الى كتابه القصه متاثرا ب صداقت ه ل ,False,MISC
968,968,حمد صالح ,حمد صالح ,و اتجه الى كتابه القصه متاثرا ب صداقت ه ل محمود جنداري الذي كان صديقا حميما لاخي ه احمد الذي فارق الحياه في عز شباب ه عام 1975. تاثر ,True,SAME PERSON
969,969,حمد صالح ,محمود جنداري,محمود جنداري الذي كان صديقا حميما لاخي ه احمد الذي فارق الحياه في عز شباب ه عام 1975. تاثر حمد صالح ب الاسلوب و الطريقه التي يكتب ب ها ,False,STUDY
970,970,حمد صالح ,حمد صالح ,و هي توضح مضامين القصص الثمان التي ضمت ها المجموعه ف جميع شخصيات ,True,SAME PERSON
971,971,حمد صالح ,حمد صالح ,و قد كتب ها ,True,SAME PERSON
972,972,حمد صالح ,حمد صالح ,مهووسا ب الشجره و يصرون على قطع ها ل اخراج ه من حدس ه و تاتي اللحظه الحاسمه ل تاخذ ه الى البعيد .. و قد قدم ل نا ,True,SAME PERSON
973,973,حمد صالح ,حمد صالح ,ها كامل و لكن ه لم يعد ل ان ه هو الاخر ذهب ل لمجهول الانفاس حيث الاجواء و الشخصيات و الفكره متشابهه و لكن ها تدلل على مهاره ,True,SAME PERSON
974,974,حمد صالح ,حمد صالح ,ثم انتظار موت ه بعد اصابت ه ب الحصبه و قد بدا ,True,SAME PERSON
975,975,حمد صالح ,حمد صالح ,الصور و الاصوات و الصخب ذنبا يتطلع نحو ه ب عينين متقدتين و تاهب واضح ل لصراع و التحدي و لكن دون جدوى ص116 ب هذه النهايه الرائعه ينهي ,True,SAME PERSON
976,976,حمد صالح ,حمد صالح ,الجامع الذي ترعرع في ه و اصبح قيم ه التي يعتز ب ها في قصت ه الجامع التي اغرق ها ب التقريريه و الانشائيه .. ان ما يميز قصص ,True,SAME PERSON
977,977,حمد صالح ,حمد صالح ,اما قصه الجامع ف هي غريبه عن بيئت ه .. و كان علي ه ان يكثر من توظيف التراث الشعبي في قصص ه فوظف ها توظيفا ناجحا و التزم ,True,SAME PERSON
978,978,حمد صالح ,حمد صالح ,ب اسمائ ها و هو مجيد في ذلك ل توضيح الابعاد ب النسبه ل لمكان و اعطاء الحدث رونق ه و حيويت ه و ديمومت ه .. و يعمد ,True,SAME PERSON
979,979,حمد صالح ,حمد صالح ,الدقه و الترهل ك ما في قصه الملاذات ).. و هو طلي الاسلوب جميله و تعبر جمل ه عن الفكره التي يريد عرض ها .. و قد توزعت روايه ,True,SAME PERSON
980,980,حمد صالح ,محمد عباس,مايعيق سير ه .. و الصراع الزماني بين الماضي و الحاضر و المستقبل من ناحيه و النور و الظلمه من ناحيه اخرى و في الشخصيات بين الوعي المتمثل في ,False,MISC
981,981,حمد صالح ,محمد عباس,غسلا ل لعار تخلصا من زينه عدنان التي رفضت الزواج فضلا عن اشتداد الصراع في الحبكه الروائيه بين السكون المتمثل ب رتابه الحياه في القريه الحركه المتمثله ب رفض ,False,MENTION
982,982,حمد صالح ,حمد صالح ,المتمثل ب رتابه الحياه في القريه الحركه المتمثله ب رفض محمد عباس و زينه عدنان ل هذه السكونيه القاتله حتى لو ادت في النهايه الى الموت .. لقد ترك ,True,SAME PERSON
983,983,حميد غزال ال كشموله,المحامي عبدالقادر الدبوني,م اجازه المحاماه 3/4/1951 ثم توظف في جهاز الاصلاح الزراعي و احيل الى التقاعد في 1/5/1978 م و عاد الى المحاماه في 10/10/1979- كان في بدايه قد عمل مع ,False,COMPANIONSHIP
984,984,حنا بطرس ,حنا بطرس ,nan,True,SAME PERSON
985,985,حنا بطرس ,حنا بطرس ,في عام 1918 دخل موسيقى الجيش العثماني ثم رفع الى رتبه رئيس عرفاء ل نبوغ ه الموسيقى و سرح من الجيش عام 1918 و عين معلما عام 1921 عين ,True,SAME PERSON
986,986,حنا حبش ,حنا حبش ,nan,True,SAME PERSON
987,987,حنا حبش ,حنا حبش ,و قد ظهر اول عمل مسرحي في حدود علم نا عام 1880 ل لاب ,True,SAME PERSON
988,988,حنا خياط ,حنا رسام,و داب ,False,MISC
989,989,حنا خياط ,حنا خياط ,معالجت ها و مكافحت ها فيما يتعلق ب التيفوئيد و الملاريا و بثره العراق و الجدري و قال عند ها هاري سندرسن في مذكرات ه : كان د . ,True,SAME PERSON
990,990,حنا خياط ,حنا خياط ,و كانت معلومات ه عن المشاكل الصحيه التي تواجه الحكومه فريده في باب ها و حين احيل على التقاعد بعد عده سنوات عين عضوا في مجلس الاعيان و قدم ,True,SAME PERSON
991,991,حنا خياط ,فيصل الاول,التي تواجه الحكومه فريده في باب ها و حين احيل على التقاعد بعد عده سنوات عين عضوا في مجلس الاعيان و قدم حنا خياط مشروع ه الطبي ل لملك ,False,WORK
992,992,حنا رحماني ,افرام رحماني,شهاده عاليه في الفلسفه و اللاهوت عام 1912. عين استاذا ل لفلسفه السكو ل طيقيه اللاتينيه في دير الشرفه ثم رقي الى المرتبه الكهنوتيه سنه 1916 ب رعايه البطريرك ,False,MISC
993,993,حنا رسام ,حنا رسام ,nan,True,SAME PERSON
994,994,حنا رسام ,حنا رسام ,كان ,True,SAME PERSON
995,995,حيدر محمود عبدالرزاق ,فيصل الثاني,اكمل الدراسه الابتدائيه في مدرسه ,False,MISC
996,996,حيدر يونس ,رؤوف الحاج علي,ه  شريفا متعاونا  شجاعا واعيا ). دخل المدرسه القحطانيه الابتدائيه و اشترك في فريق ها الاول و هو في الصف الخامس حيث اشرف على تدريب ه الاستاذ ,False,WORK
997,997,حيدر يونس ,حيدر يونس ,دخل ,True,SAME PERSON
998,998,حيدر يونس ,عبدالجبار صالح,دخل حيدر يونس المتوسطه الغربيه سنه 1936 و تعهد ه الاستاذ ,False,MISC
999,999,حيدر يونس ,عبدالجبار محمد صالح,دار المعلمين الابتدائيه  و اشترك في فريق ها الاول ل كره القدم .. بدا حيات ه العمليه الوظيفيه مدرسا ل لتربيه الرياضيه في المدرسه الاعداديه سنه1943 مع الاستاذ ,False,WORK
1000,1000,حيدر يونس ,حيدر يونس ,الجزيره ) و فريق جمعيه المعلمين و يقول عن نفس ه : ان ني مدين ل تلك الخدمه العمليه الطويله  اذ هي علمت ني كيف اعمل اشترك الاستاذ ,True,SAME PERSON
1001,1001,حيدر يونس ,حيدر يونس ,و قد ظل الاستاذ ,True,SAME PERSON
1002,1002,خالد صالح العسلي ,خالد صالح العسلي ,و يمتاز ,True,SAME PERSON
1003,1003,خالد صالح العسلي ,احمد صالح العلي,في عمل ه و اخلاق ه العاليه  و قد خدم جامعه بغداد خدمه كبيره و مع ذلك لم يحددوا ل ه مرتبا تقاعديا الا بعد جهود استاذ ه ,False,SAME PERSON
1004,1004,خالد محمد علي ,الشاب خالد محمد علي,عند ما تلتقي الموهبه و الشباب و الدراسه و التواضع في ايه عمليه ابداعيه تكون النتائج ذات تاثيرات كبيره .. و الفنان ,False,SAME PERSON
1005,1005,خالد محمد علي ,جميل بشير,خطوات واثقه رصن ها ب الدراسه و المتابعه و تراكم الخبره ف كانت الحصيله عازفا ماهرا قديرا يضاف الى قائمه ابرع عازفي العود و الكمان في قطر نا امثال ,False,WORK
1006,1006,خالد محمد علي ,منير بشير,ها ب الدراسه و المتابعه و تراكم الخبره ف كانت الحصيله عازفا ماهرا قديرا يضاف الى قائمه ابرع عازفي العود و الكمان في قطر نا امثال جميل بشير  ,False,WORK
