,seq,name,name2,content,isconfirmed,class
2827,2827,محمد رؤوف الغلامي ,احمد الجليلي,الاداريه و فاز كل من : امين بك الجليلي  و محمد رؤوف الغلامي  و سعيد ثابت  و عبدالله علي العمري  و نجيب الجادر  و ,False,WORK
2828,2828,محمد رؤوف الغلامي ,مكي الشربتي,من : امين بك الجليلي  و محمد رؤوف الغلامي  و سعيد ثابت  و عبدالله علي العمري  و نجيب الجادر  و احمد الجليلي  و ,False,COMPANIONSHIP
2829,2829,محمد رؤوف الغلامي ,ابراهيم عطار باشي,الجليلي  و محمد رؤوف الغلامي  و سعيد ثابت  و عبدالله علي العمري  و نجيب الجادر  و احمد الجليلي  و مكي الشربتي  و ,False,WORK
2830,2830,محمد رؤوف الغلامي ,محمد رؤوف الغلامي ,المسرحيه في الموصل التي تستمد احداث ها من التاريخ العربي الاسلامي ل بعث روح اليقظه القوميه في نفوس الشباب و تشكلت اللجنه الاداريه ل لتمثيل من خمسه اعضاء هم ,True,SAME PERSON
2831,2831,محمد رؤوف الغلامي ,حسيب السعدي,ها من التاريخ العربي الاسلامي ل بعث روح اليقظه القوميه في نفوس الشباب و تشكلت اللجنه الاداريه ل لتمثيل من خمسه اعضاء هم محمد رؤوف الغلامي- معتمد النادي- و ,False,WORK
2832,2832,محمد رؤوف الغلامي ,فاضل الصيدلي,العربي الاسلامي ل بعث روح اليقظه القوميه في نفوس الشباب و تشكلت اللجنه الاداريه ل لتمثيل من خمسه اعضاء هم محمد رؤوف الغلامي- معتمد النادي- و حسيب السعدي و ,False,WORK
2833,2833,محمد رؤوف الغلامي ,اسماعيل فرج,بعث روح اليقظه القوميه في نفوس الشباب و تشكلت اللجنه الاداريه ل لتمثيل من خمسه اعضاء هم محمد رؤوف الغلامي- معتمد النادي- و حسيب السعدي و فاضل الصيدلي و ,False,WORK
2834,2834,محمد رؤوف الغلامي ,عبدالمجيد شوقي البكري,القوميه في نفوس الشباب و تشكلت اللجنه الاداريه ل لتمثيل من خمسه اعضاء هم محمد رؤوف الغلامي- معتمد النادي- و حسيب السعدي و فاضل الصيدلي و اسماعيل فرج و ,False,WORK
2835,2835,محمد رؤوف الغلامي ,عبدالمجيد شوقي,معتمد النادي- و حسيب السعدي و فاضل الصيدلي و اسماعيل فرج و عبدالمجيد شوقي البكري و قررت لجنه اداره التمثيل  تقديم مسرحيه فتح عموريه اولا و عهدت الى ,False,WORK
2836,2836,محمد رؤوف الغلامي ,فاضل الصيدلي,فاضل الصيدلي و اسماعيل فرج و عبدالمجيد شوقي البكري و قررت لجنه اداره التمثيل  تقديم مسرحيه فتح عموريه اولا و عهدت الى عبدالمجيد شوقي كتابت ها و الى ,False,WORK
2837,2837,محمد رؤوف الغلامي ,يحيى ق عبدالواحد,فضلا عن المسرحيات التي قدم ها دار التمثيل العربي مثل وفود النعمان الى كسرى  و فتح مصر ل ,False,WORK
2838,2838,محمد رؤوف الغلامي ,محمد رؤوف الغلامي ,و كان ل ,True,SAME PERSON
2839,2839,محمد رؤوف الغلامي ,محمود بك ال,و كان ل محمد رؤوف الغلامي مجلس خاص في مدرسه ,False,MISC
2840,2840,محمد رؤوف الغلامي ,محمد رؤوف الغلامي ,و كان ل محمد رؤوف الغلامي مجلس خاص في مدرسه محمود بك ال محضر باشي العلميه الواقعه في محله النبي جرجيس ب القرب من دار والد ه ,True,SAME PERSON
2841,2841,محمد رؤوف الغلامي ,علي جودت الايوبي,محمد سعيد الغلامي  اطلق علي ها الندوه الغلاميه فتحت ابواب ها ل لشباب من ذوي النزعه القوميه و كان يحضر ها حمله الفكر القومي مثل مولود مخلص و ,False,WORK
2842,2842,محمد رؤوف الغلامي ,قاسم الشعار,يحضر ها حمله الفكر القومي مثل مولود مخلص و علي جودت الايوبي و حمدي جميران و غير هم و م من يجمعون بين الفكر القومي و الفكر الديني مثل ,False,COMPANIONSHIP
2843,2843,محمد رؤوف الغلامي ,محمود الملاح,الفكر القومي مثل مولود مخلص و علي جودت الايوبي و حمدي جميران و غير هم و م من يجمعون بين الفكر القومي و الفكر الديني مثل قاسم الشعار و ,False,COMPANIONSHIP
2844,2844,محمد رؤوف الغلامي ,داؤد ال زياده,مولود مخلص و علي جودت الايوبي و حمدي جميران و غير هم و م من يجمعون بين الفكر القومي و الفكر الديني مثل قاسم الشعار و محمود الملاح و ,False,STUDY
2845,2845,محمد رؤوف الغلامي ,و فاضل الصيدلي,و حمدي جميران و غير هم و م من يجمعون بين الفكر القومي و الفكر الديني مثل قاسم الشعار و محمود الملاح و داؤد ال زياده و نشات المفتي ,False,COMPANIONSHIP
2846,2846,محمد رؤوف الغلامي ,ضياء يونس,غير هم و م من يجمعون بين الفكر القومي و الفكر الديني مثل قاسم الشعار و محمود الملاح و داؤد ال زياده و نشات المفتي و فاضل الصيدلي و ,False,COMPANIONSHIP
2847,2847,محمد رؤوف الغلامي ,عبدالمنعم الغلامي,ال زياده و نشات المفتي و فاضل الصيدلي و ضياء يونس و حسين النعلبند و رؤف الشهواني و غير هم ينظر / اسرار الكفاح الوطني في الموصل ح1  ,False,FAMILY
2848,2848,محمد رؤوف الغلامي ,محمد رؤوف الغلامي ,المفتي و فاضل الصيدلي و ضياء يونس و حسين النعلبند و رؤف الشهواني و غير هم ينظر / اسرار الكفاح الوطني في الموصل ح1  عبدالمنعم الغلامي و يعد ,True,SAME PERSON
2849,2849,محمد رؤوف الغلامي ,محمد رؤوف الغلامي ,و من كتب ه المطبوعه :- 1- الجمان المنضّد في مدح الوزير احمد  ديوان محمد الغلامي1940 تحقيق و تعليق ). 2- العلم السامي في ماثر ترجمه العلامه الشيخ ,True,SAME PERSON
2850,2850,محمد رؤوف الغلامي ,محمد رؤوف الغلامي ,ترجمه العلامه الشيخ محمد مصطفى الغلامي صاحب كتاب شمامه العنبر و الزهر المعبرّ المتوفى سنه 1186 ه تحقيق و تعليق 1942. 3- تخميس همزيه الامام البو صيري ل لشيخ ,True,SAME PERSON
2851,2851,محمد رؤوف الغلامي ,حسين الغلامي,و شرح 1940. 4- المردد من الامثال العاميه الموصليه 1964. 5- التحفه البهيه في محضر اجازه علميه 1944. 6- اصحاب بدر  او المجاهدون الاولون  منظومه ل لشيخ ,False,MISC
2852,2852,محمد رؤوف الغلامي ,عبدالفتاح الجليلي,التحفه البهيه في محضر اجازه علميه 1944. 6- اصحاب بدر  او المجاهدون الاولون  منظومه ل لشيخ حسين الغلامي شرح و تحقيق 1966.7- ضوء المصباح في مدح الوزير ,False,MISC
2853,2853,محمد رؤوف الغلامي ,محمد رؤوف الغلامي ,محضر اجازه علميه 1944. 6- اصحاب بدر  او المجاهدون الاولون  منظومه ل لشيخ حسين الغلامي شرح و تحقيق 1966.7- ضوء المصباح في مدح الوزير عبدالفتاح الجليلي ل ,True,SAME PERSON
2854,2854,محمد رشيد الفيل ,سعيد المغربي,14- جغرافيه العراق 1965. 15- الصحين من قرى الاهوار / دراسه انثروبولوجيه 1968. 16- العراق و الجزيره ك ما وصف ها ,False,WORK
2855,2855,محمد زكي,: طه,ه الاوساط الفنيه في مجالس الانس و الطرب شاديا باغانيه الاسره  بدا الغناء عام 1973 في منظمه الطلائع العائده ل اتحاد شباب العراق و تدرب على يد الفنان ,False,STUDY
2856,2856,محمد زكي,سعد رجب,من ه الالوان الغنائيه الجميله و هو يرفض الابتذال في الفن و يعد ه نوعا من الدجل  و من اغاني ه المعروفه اغنيه تحبونالله من كلمات و الحان ,False,WORK
2857,2857,محمد زكي,زكي ابراهيم,في الفن و يعد ه نوعا من الدجل  و من اغاني ه المعروفه اغنيه تحبونالله من كلمات و الحان سعد رجب و اغنيه عاطفيه من الكلمات و الحان ,False,FAMILY
2858,2858,محمد سعيد احمد الرحو  ,الدكتور حسن علي الذنون,في النظريه العامه ل لالتزام  الجزء الاول – مصادر الالتزام – دراسه مقارنه في التشريعات الاردنيه و العراقيه و الكويتيه مع الفقه الاسلامي  تاليف مشترك مع الاستاذ ,False,COMPANIONSHIP
2859,2859,محمد سعيد احمد الرحو  ,الدكتور حسن علي الذنون,و الوجيز في النظريه العامه ل لالتزام  الجزء الثاني – احكام الالتزام دراسه مقارنه – تاليف مشترك مع الاستاذ ,False,MISC
2860,2860,محمد سعيد احمد الرحو  ,كاظم محمد جواد,و النظريه العامه ل لتامين البري في القانون الاردني – دراسه مقارنه  قيد التاليف المشترك مع د . نداء ,False,SAME PERSON
2861,2861,محمد سعيد الجليلي ,محمد سعيد الجليلي ,nan,True,SAME PERSON
2862,2862,محمد سعيد الجليلي ,عبدالمجيد شوقي البكري,في تشكيل اعضاء دائميين ل لتمثيل في اللجنه التمثيليه التي شكلت ل لنادي الادبي و كان من المقرر ان يقوم ب تمثيل الدور الرئيس في مسرحيه فتح عموريه ل ,False,WORK
2863,2863,محمد سعيد الجليلي ,محمد سعيد الجليلي ,و كان ,True,SAME PERSON
2864,2864,محمد سعيد الجليلي ,رؤوف الغلامي,و كان محمد سعيد الجليلي العضد الايمن ل ,False,MISC
2865,2865,محمد سليم ,محمد سليم ,و اولاد ه كل هم فنانون : و هممحمد رشاد و سعاد و جواد و نزار و نزيهه و كانت الاسره تحب الفنون و سماع الموسيقى الكلاسيكيه و كان ,True,SAME PERSON
2866,2866,محمد سليم ,محمد سليم ,يقرا ه و يجود القران الكريم  و لم ترق ل هم الحياه المغلقه في الموصل فرحلوا الى بغداد حيث المجال اكثر انفتاحا بعد تاسيس الحكم الملكي و احب ,True,SAME PERSON
2867,2867,محمد سليم ,جواد سليم,و في عام 1931 اقيم اول معرض ل لاعمال الفنيه في جناح من المعرض الصناعي الزراعي و نال ,False,FAMILY
2868,2868,محمد سليم ,اكرم شكري,الفضيه في النحت و عمر ه احدى عشره سنه و كان ل هذا المعرض اهميه اذ ساعد على ارسال الموهوبين الى الخارج ل دراسه الفنون التشكيليه و من هم ,False,STUDY
2869,2869,محمد سليم ,فائق حسن,و عمر ه احدى عشره سنه و كان ل هذا المعرض اهميه اذ ساعد على ارسال الموهوبين الى الخارج ل دراسه الفنون التشكيليه و من هم اكرم شكري  ,False,STUDY
2870,2870,محمد سليم ,عطا صبري,احدى عشره سنه و كان ل هذا المعرض اهميه اذ ساعد على ارسال الموهوبين الى الخارج ل دراسه الفنون التشكيليه و من هم اكرم شكري  فائق حسن  ,False,STUDY
2871,2871,محمد سليم ,حافظ الدروبي,و كان ل هذا المعرض اهميه اذ ساعد على ارسال الموهوبين الى الخارج ل دراسه الفنون التشكيليه و من هم اكرم شكري  فائق حسن  عطا صبري  ,False,STUDY
2872,2872,محمد سليم احمد الجلبي ,داؤد الجلبي,والد الدكتور ,False,FAMILY
2873,2873,محمد سليم الاردلاني  ,محمد امين,قدم الموصل ل معالجه رمد في عين ه عن ,False,FAMILY
2874,2874,محمد سليمان فيضي,سليمان فيضي الموصلي,هو الابن الكبير ل ,False,SAME PERSON
2875,2875,محمد شكري ,محمد شكري ,nan,True,SAME PERSON
2876,2876,محمد شكري ,حسين العباسي,من رجالالدين و اسند الي ه الافتاء و خطابه الجامع الكبير في العماديه و التدريس في مدرسه قبهان المشهوره في العماديه و هي من بناء احد ملوك الطوائف السلطان ,False,MISC
2877,2877,محمد شيت الجومرد ,حسن البزاز,لا اروم ب ه في الوصل الاك و كم سرقت الغفا عن اعيني عنفا يضم ديوان ه المطبوع تسع قصائد و بعض التشطيرات و الابيات و قدم ل ه ,False,MISC
2878,2878,محمد شيت الجومرد ,محمد شيت الجومرد الموصلي,المطبوع تسع قصائد و بعض التشطيرات و الابيات و قدم ل ه حسن البزاز ب قول ه : يقول المستمد من فيض احسان الكبير العلي الفقير الي ه تعالى ,False,SAME PERSON
2879,2879,محمد شيت الجومرد ,عبدالله فيضي الموصلي,العلي الفقير الي ه تعالى محمد شيت الجومرد الموصلي هذا ديوان حاك برد ه ذهني الفاتر و نظم عقد ه فكري الدائر و من نظم ه تخميس قصيده ل ,False,MISC
2880,2880,محمد شيت الجومرد ,عبدالله نعمان الدباغ,في يوم حرب هم ف لم قد تصديت القوم ل طعن همو كم ب القنا خرّقت اكناف جمع هموادخلت هم ب الرعب خلف الستائر و قال مشطرا قصيده ل ,False,MISC
2881,2881,محمد صالح الجوادي ,محمد صالح الجوادي ,nan,True,SAME PERSON
2882,2882,محمد صالح الجوادي ,الحافظ اسماعيل الجوادي,و هو من اسره معروفه في الموصل ل ها مكانت ها الدينيه و الاجتماعيه توفي والد ه الشيخ ,False,FAMILY
2883,2883,محمد صالح الجوادي ,عثمان افندي الرضواني,ها الدينيه و الاجتماعيه توفي والد ه الشيخ الحافظ اسماعيل الجوادي و كان عمر ه خمس سنوات ف تربى ب رعايه عم ه و قريب ه لام ه الحاج ,False,STUDY
2884,2884,محمد صالح الجوادي ,محمد افندي الشيخ عثمان الرضواني,و العلماء ف احب العلم و العلماء و لم يدع علما من الاعلام الا و اخذ عن ه  و اخذ عن شيوخ عصر ه المبرزين : 1 الشيخ ,False,STUDY
2885,2885,محمد صالح الجوادي ,احمد افندي الجوادي,عن ه  و اخذ عن شيوخ عصر ه المبرزين : 1 الشيخ محمد افندي الشيخ عثمان الرضواني  اخذ علم الفقه و الفرائض 2 و اخذ عن الشيخ ,False,STUDY
2886,2886,محمد صالح الجوادي ,عثمان المولوي,الشيخ محمد افندي الشيخ عثمان الرضواني  اخذ علم الفقه و الفرائض 2 و اخذ عن الشيخ احمد افندي الجوادي علم القراءات السبع 3 و اخذ عن الشيخ الملا ,False,STUDY
2887,2887,محمد صالح الجوادي ,محمد امين الفخري,الفرائض 2 و اخذ عن الشيخ احمد افندي الجوادي علم القراءات السبع 3 و اخذ عن الشيخ الملا عثمان المولوي الموصلي علم القراءات العشر 4 و اخذ عن الشيخ ,False,STUDY
2888,2888,محمد صالح الجوادي ,محمد شيت الجومرد,علم القراءات السبع 3 و اخذ عن الشيخ الملا عثمان المولوي الموصلي علم القراءات العشر 4 و اخذ عن الشيخ محمد امين الفخري علم الفرائض 5 و اخذ عن ,False,SAME PERSON
2889,2889,محمد صالح الجوادي ,محمد افندي الفيل,عثمان المولوي الموصلي علم القراءات العشر 4 و اخذ عن الشيخ محمد امين الفخري علم الفرائض 5 و اخذ عن محمد شيت الجومرد علم اللغه 6 و اخذ عن ,False,SAME PERSON
2890,2890,محمد صالح الجوادي ,احمد افندي الجوادي,اجازات ه :- 1- اجازه في القراءات السبع من الشيخ ,False,FAMILY
2891,2891,محمد صالح الجوادي ,محمد افندي الرضواني,اجازات ه :- 1- اجازه في القراءات السبع من الشيخ احمد افندي الجوادي عام 1328 ه  2- الاجازه العلميه من الشيخ ,False,STUDY
2892,2892,محمد صالح الجوادي ,عثمان الموصلي,القراءات السبع من الشيخ احمد افندي الجوادي عام 1328 ه  2- الاجازه العلميه من الشيخ محمد افندي الرضواني سنه1330 ه  3- اجازه في القراءات العشر من الملا ,False,STUDY
2893,2893,محمد صالح الجوادي ,احمد الجوادي,من الشيخ محمد افندي الرضواني سنه1330 ه  3- اجازه في القراءات العشر من الملا عثمان الموصلي عام 13314- اجازه في علوم التفسير و الحديث و الاوراد من الشيخ ,False,STUDY
2894,2894,محمد صالح الجوادي ,محمد افندي الرضواني,عثمان الموصلي عام 13314- اجازه في علوم التفسير و الحديث و الاوراد من الشيخ احمد الجوادي  5- اجازه ب الاحاديث و المرويات و الادعيه و الصلوات من الشيخ ,False,STUDY
2895,2895,محمد صالح الجوادي ,عثمان الموصلي,الاوراد من الشيخ احمد الجوادي  5- اجازه ب الاحاديث و المرويات و الادعيه و الصلوات من الشيخ محمد افندي الرضواني  6- اجازه ب حديث المصافحه من الملا ,False,STUDY
2896,2896,محمد صالح الجوادي ,محمد طاهر مصطفى البريفكاني, 6- اجازه ب حديث المصافحه من الملا عثمان الموصلي  7- اجازه في الطريقه القادريه من الشيخ محمدالدين شمسالدين الافغاني  8- اجازه في الطريقه القادريه من الشيخ ,False,STUDY
2897,2897,محمد صالح الجوادي ,عبدالواحد الشيخ عبداللطيف,اجازه في الطريقه القادريه من الشيخ محمدالدين شمسالدين الافغاني  8- اجازه في الطريقه القادريه من الشيخ محمد طاهر مصطفى البريفكاني  9- اجازه في الطريقه الرفاعيه من الشيخ ,False,STUDY
2898,2898,محمد صالح الجوادي ,محمد سعيد,اجازه في الطريقه القادريه من الشيخ محمد طاهر مصطفى البريفكاني  9- اجازه في الطريقه الرفاعيه من الشيخ عبدالواحد الشيخ عبداللطيف  10- اجازه في الطريقه النقشبنديه من الشيخ ,False,STUDY
2899,2899,محمد صالح الجوادي ,احمد الجوادي,و حصل على لقب نتيجه القراء و محبالدين من الشيخ ,False,STUDY
2900,2900,محمد صالح الجوادي ,محمد الرضواني,و حصل على لقب نتيجه القراء و محبالدين من الشيخ احمد الجوادي و حصل على لقبي سراجالدين و شيخ القراء من الشيخ ,False,STUDY
2901,2901,محمد صالح الجوادي ,حسين باشا الجليلي,النبي جرجيس 3- مدرسا و شيخا ل لقراء في جامع النبي يونس 4- مدرسا في المدرسه المتوسطه الفيصليه الدينيه 5- مدرسا في اعداديه الارشاد الدينيه 6- مدرسا في جامع ,False,MISC
2902,2902,محمد صالح الجوادي ,احمد الجوادي,و من اجازت ه في القراءات السبع من الحاج ,False,MISC
2903,2903,محمد صالح الجوادي ,احمد عبدالوهاب افندي,و من اجازت ه في القراءات السبع من الحاج احمد الجوادي  ورد في ها ما ياتي :- يقول الحاج ,False,MISC
2904,2904,محمد صالح الجوادي ,العليم الهادي,و اعتنائ ه و حسن الخصال  الولد الاسعد و الالمعي الاوحد و العلم الفرد  التجيب الصالح و الذكي الزكي و التقي النقي الناصح المستفيد من فيض الملك ,False,COMPANIONSHIP
2905,2905,محمد صالح الجوادي ,محمد صالح الجوادي , الولد الاسعد و الالمعي الاوحد و العلم الفرد  التجيب الصالح و الذكي الزكي و التقي النقي الناصح المستفيد من فيض الملك العليم الهادي  نتيجه القراء الشيخ ,True,SAME PERSON
2906,2906,محمد صالح الحبار ,محمد صالح الحبار ,nan,True,SAME PERSON
2907,2907,محمد صالح الحبار ,اسماعيل عبدالله,هو محمد صالح عبدالرحمن الحسن ,False,LIKE
2908,2908,محمد صالح الحبار ,احمد الجوادي,و القراءه ف تعهد ه والد ه و قرا علي ه القران و القراءات السبعه و حفظ القران الكريم و اخذ الاجازه في القراءات على شيخ ه العلامه الحاج ,False,STUDY
2909,2909,محمد صالح الحبار ,احمد الحبار,و مرجعا ل لافتاء في الموصل كثير الاهتمام ب علوم الشريعه حافظا ل لسنه و المواريث قرا علي ه كثير من الطلاب و كان ابرز هم ولد ه الحاج ,False,FAMILY
2910,2910,محمد صالح الخطيب ,محمد صالح الخطيب ,nan,True,SAME PERSON
2911,2911,محمد صالح الخطيب ,عبدالله باشعالم الموصلي,طه الخطيب الموصلي الطائي الملقب ضياءالدين درس على رئيس علماء الموصل ,False,STUDY
2912,2912,محمد صالح الخطيب ,محمد الرضواني,و درس علي ه الشيخ ,False,STUDY
2913,2913,محمد صالح الشيخ علي ,محمد صالح الشيخ علي ,nan,True,SAME PERSON
2914,2914,محمد صالح الشيخ علي ,محمد سعيد القاضي,احب الخط منذ صباه و عاش عند الخطاط محيالدين و درس الخط على ,False,STUDY
2915,2915,محمد صالح الشيخ علي ,محمد صالح,حظي ,False,SAME PERSON
2916,2916,محمد صالح الشيخ علي ,صالح السعدي,حظي محمد صالح ب نماذج و لوحات ل خطاطين مثل ,False,MISC
2917,2917,محمد صالح الشيخ علي ,محمد درويش البروشكي,حظي محمد صالح ب نماذج و لوحات ل خطاطين مثل صالح السعدي ت 1829 و ,False,MISC
2918,2918,محمد صالح الشيخ علي ,محمد عزه,حظي محمد صالح ب نماذج و لوحات ل خطاطين مثل صالح السعدي ت 1829 و محمد درويش البروشكي ت1805 م و اهتم ب كراسه الخط التركي ل لخطاط ,False,MISC
2919,2919,محمد صالح الشيخ علي ,الحافظ تحسين,1829 و محمد درويش البروشكي ت1805 م و اهتم ب كراسه الخط التركي ل لخطاط محمد عزه ت1902 معلم الخط في المكتب السلطاني ب اسطنبول و اخي ه الخطاط ,False,MISC
2920,2920,محمد صالح الشيخ علي ,فائق الدبوني,م و اهتم ب كراسه الخط التركي ل لخطاط محمد عزه ت1902 معلم الخط في المكتب السلطاني ب اسطنبول و اخي ه الخطاط الحافظ تحسين ت1912 حتى منح ه ,False,MISC
